{
 "dataset_aggregate_hash": "4c7a696981a4b8f19200e2a8d37ab147c18da08218d000801d634e8acd43e411",
 "dataset_id": "px4_public_v1",
 "log_count": 26,
 "logs": [
  {
   "airframe_type": null,
   "alert_episodes": 0,
   "annotation_status": "UNANNOTATED",
   "autopilot": "PX4",
   "available_channels": [
    "baro",
    "imu0"
   ],
   "byte_size": null,
   "campaign_id": null,
   "confidentiality": "PUBLIC",
   "content_sha256": null,
   "dataset_id": "px4_public_v1",
   "dataset_partition": "DEVELOPMENT",
   "duplicate_of": null,
   "eligible_for_blind_evaluation": false,
   "exclusion_reason": null,
   "file_present": false,
   "firmware_version": null,
   "flight_duration_s": 31.5,
   "health_classification": "UNANNOTATED",
   "known_anomalies": [],
   "known_faults": [],
   "license": null,
   "log_id": "0d8548ba-0ee2-445c-bcc9-ca2807282c0f",
   "missing_channels": [
    "imu1",
    "mag"
   ],
   "mission_id": null,
   "monitored_duration_s": 11.5,
   "notes": [
    "seen during field_mode / offline-posture development (C2 train-test contamination): not eligible for held-out or blind use",
    "file not acquired in this environment; content hash unknown",
    "2/8 trust-graph nodes carried usable data; the graph ran degraded"
   ],
   "parse_status": "PARSED_IN_COMMITTED_CAMPAIGN",
   "redistribution_permission": "UNKNOWN",
   "retrieved_at": null,
   "sensor_inventory": [
    "baro",
    "imu0"
   ],
   "source_reference": "https://review.px4.io/download_log?log=0d8548ba-0ee2-445c-bcc9-ca2807282c0f",
   "source_type": "REAL_FLIGHT",
   "split_group_id": "px4_public_v1_all",
   "suspected_near_duplicate_of": [],
   "used_for_architecture_design": true,
   "used_for_threshold_tuning": true,
   "vehicle_id": null
  },
  {
   "airframe_type": null,
   "alert_episodes": 0,
   "annotation_status": "UNANNOTATED",
   "autopilot": "PX4",
   "available_channels": [
    "baro",
    "battery",
    "gps",
    "imu0",
    "mag"
   ],
   "byte_size": null,
   "campaign_id": null,
   "confidentiality": "PUBLIC",
   "content_sha256": null,
   "dataset_id": "px4_public_v1",
   "dataset_partition": "DEVELOPMENT",
   "duplicate_of": null,
   "eligible_for_blind_evaluation": false,
   "exclusion_reason": null,
   "file_present": false,
   "firmware_version": null,
   "flight_duration_s": 32.4,
   "health_classification": "UNANNOTATED",
   "known_anomalies": [],
   "known_faults": [],
   "license": null,
   "log_id": "0f8dd10d-41dc-46f0-ae5e-7f0af482651e",
   "missing_channels": [],
   "mission_id": null,
   "monitored_duration_s": 12.399999999999999,
   "notes": [
    "seen during field_mode / offline-posture development (C2 train-test contamination): not eligible for held-out or blind use",
    "file not acquired in this environment; content hash unknown",
    "5/8 trust-graph nodes carried usable data; the graph ran degraded"
   ],
   "parse_status": "PARSED_IN_COMMITTED_CAMPAIGN",
   "redistribution_permission": "UNKNOWN",
   "retrieved_at": null,
   "sensor_inventory": [
    "baro",
    "battery",
    "gps",
    "imu0",
    "mag"
   ],
   "source_reference": "https://review.px4.io/download_log?log=0f8dd10d-41dc-46f0-ae5e-7f0af482651e",
   "source_type": "REAL_FLIGHT",
   "split_group_id": "px4_public_v1_all",
   "suspected_near_duplicate_of": [],
   "used_for_architecture_design": true,
   "used_for_threshold_tuning": true,
   "vehicle_id": null
  },
  {
   "airframe_type": null,
   "alert_episodes": 0,
   "annotation_status": "UNANNOTATED",
   "autopilot": "PX4",
   "available_channels": [
    "baro",
    "battery",
    "gps",
    "imu0",
    "mag"
   ],
   "byte_size": null,
   "campaign_id": null,
   "confidentiality": "PUBLIC",
   "content_sha256": null,
   "dataset_id": "px4_public_v1",
   "dataset_partition": "DEVELOPMENT",
   "duplicate_of": null,
   "eligible_for_blind_evaluation": false,
   "exclusion_reason": null,
   "file_present": false,
   "firmware_version": null,
   "flight_duration_s": 50.0,
   "health_classification": "UNANNOTATED",
   "known_anomalies": [],
   "known_faults": [],
   "license": null,
   "log_id": "150b8aef-ed6e-4380-9e0c-998bb2a020c7",
   "missing_channels": [
    "imu1"
   ],
   "mission_id": null,
   "monitored_duration_s": 30.0,
   "notes": [
    "seen during field_mode / offline-posture development (C2 train-test contamination): not eligible for held-out or blind use",
    "file not acquired in this environment; content hash unknown",
    "5/8 trust-graph nodes carried usable data; the graph ran degraded"
   ],
   "parse_status": "PARSED_IN_COMMITTED_CAMPAIGN",
   "redistribution_permission": "UNKNOWN",
   "retrieved_at": null,
   "sensor_inventory": [
    "baro",
    "battery",
    "gps",
    "imu0",
    "mag"
   ],
   "source_reference": "https://review.px4.io/download_log?log=150b8aef-ed6e-4380-9e0c-998bb2a020c7",
   "source_type": "REAL_FLIGHT",
   "split_group_id": "px4_public_v1_all",
   "suspected_near_duplicate_of": [
    "5ad4ba6d-441e-45b9-96ce-06f44b5dd2ad"
   ],
   "used_for_architecture_design": true,
   "used_for_threshold_tuning": true,
   "vehicle_id": null
  },
  {
   "airframe_type": null,
   "alert_episodes": 0,
   "annotation_status": "UNANNOTATED",
   "autopilot": "PX4",
   "available_channels": [
    "baro",
    "battery",
    "gps",
    "imu0",
    "mag"
   ],
   "byte_size": null,
   "campaign_id": null,
   "confidentiality": "PUBLIC",
   "content_sha256": null,
   "dataset_id": "px4_public_v1",
   "dataset_partition": "DEVELOPMENT",
   "duplicate_of": null,
   "eligible_for_blind_evaluation": false,
   "exclusion_reason": null,
   "file_present": false,
   "firmware_version": null,
   "flight_duration_s": 47.6,
   "health_classification": "UNANNOTATED",
   "known_anomalies": [],
   "known_faults": [],
   "license": null,
   "log_id": "1a53b64e-dbde-4cf6-9376-cde4cf067b05",
   "missing_channels": [
    "imu1"
   ],
   "mission_id": null,
   "monitored_duration_s": 27.6,
   "notes": [
    "seen during field_mode / offline-posture development (C2 train-test contamination): not eligible for held-out or blind use",
    "file not acquired in this environment; content hash unknown",
    "5/8 trust-graph nodes carried usable data; the graph ran degraded"
   ],
   "parse_status": "PARSED_IN_COMMITTED_CAMPAIGN",
   "redistribution_permission": "UNKNOWN",
   "retrieved_at": null,
   "sensor_inventory": [
    "baro",
    "battery",
    "gps",
    "imu0",
    "mag"
   ],
   "source_reference": "https://review.px4.io/download_log?log=1a53b64e-dbde-4cf6-9376-cde4cf067b05",
   "source_type": "REAL_FLIGHT",
   "split_group_id": "px4_public_v1_all",
   "suspected_near_duplicate_of": [],
   "used_for_architecture_design": true,
   "used_for_threshold_tuning": true,
   "vehicle_id": null
  },
  {
   "airframe_type": null,
   "alert_episodes": 0,
   "annotation_status": "UNANNOTATED",
   "autopilot": "PX4",
   "available_channels": [
    "baro",
    "imu0"
   ],
   "byte_size": null,
   "campaign_id": null,
   "confidentiality": "PUBLIC",
   "content_sha256": null,
   "dataset_id": "px4_public_v1",
   "dataset_partition": "DEVELOPMENT",
   "duplicate_of": null,
   "eligible_for_blind_evaluation": false,
   "exclusion_reason": null,
   "file_present": false,
   "firmware_version": null,
   "flight_duration_s": 34.8,
   "health_classification": "UNANNOTATED",
   "known_anomalies": [],
   "known_faults": [],
   "license": null,
   "log_id": "241a8edf-46dc-4dbb-8b00-a8cbfcbbdda0",
   "missing_channels": [
    "imu1",
    "mag"
   ],
   "mission_id": null,
   "monitored_duration_s": 14.799999999999997,
   "notes": [
    "seen during field_mode / offline-posture development (C2 train-test contamination): not eligible for held-out or blind use",
    "file not acquired in this environment; content hash unknown",
    "2/8 trust-graph nodes carried usable data; the graph ran degraded"
   ],
   "parse_status": "PARSED_IN_COMMITTED_CAMPAIGN",
   "redistribution_permission": "UNKNOWN",
   "retrieved_at": null,
   "sensor_inventory": [
    "baro",
    "imu0"
   ],
   "source_reference": "https://review.px4.io/download_log?log=241a8edf-46dc-4dbb-8b00-a8cbfcbbdda0",
   "source_type": "REAL_FLIGHT",
   "split_group_id": "px4_public_v1_all",
   "suspected_near_duplicate_of": [],
   "used_for_architecture_design": true,
   "used_for_threshold_tuning": true,
   "vehicle_id": null
  },
  {
   "airframe_type": null,
   "alert_episodes": 0,
   "annotation_status": "UNANNOTATED",
   "autopilot": "PX4",
   "available_channels": [
    "baro",
    "battery",
    "imu0"
   ],
   "byte_size": null,
   "campaign_id": null,
   "confidentiality": "PUBLIC",
   "content_sha256": null,
   "dataset_id": "px4_public_v1",
   "dataset_partition": "DEVELOPMENT",
   "duplicate_of": null,
   "eligible_for_blind_evaluation": false,
   "exclusion_reason": null,
   "file_present": false,
   "firmware_version": null,
   "flight_duration_s": 274.2,
   "health_classification": "UNANNOTATED",
   "known_anomalies": [],
   "known_faults": [],
   "license": null,
   "log_id": "2646427a-efb4-4e21-a55a-717e0788efe0",
   "missing_channels": [
    "imu1",
    "mag"
   ],
   "mission_id": null,
   "monitored_duration_s": 254.2,
   "notes": [
    "seen during field_mode / offline-posture development (C2 train-test contamination): not eligible for held-out or blind use",
    "file not acquired in this environment; content hash unknown",
    "3/8 trust-graph nodes carried usable data; the graph ran degraded"
   ],
   "parse_status": "PARSED_IN_COMMITTED_CAMPAIGN",
   "redistribution_permission": "UNKNOWN",
   "retrieved_at": null,
   "sensor_inventory": [
    "baro",
    "battery",
    "imu0"
   ],
   "source_reference": "https://review.px4.io/download_log?log=2646427a-efb4-4e21-a55a-717e0788efe0",
   "source_type": "REAL_FLIGHT",
   "split_group_id": "px4_public_v1_all",
   "suspected_near_duplicate_of": [],
   "used_for_architecture_design": true,
   "used_for_threshold_tuning": true,
   "vehicle_id": null
  },
  {